{
  "id": "7e173ec7a3",
  "filename": "reactions/celebration/7e173ec7a3.gif",
  "source": "giphy",
  "source_id": "FZwLlKknecpYa5yOhy",
  "source_url": "https://giphy.com/gifs/sendwishonline-office-presentation-you-killed-that-FZwLlKknecpYa5yOhy",
  "category": "reactions",
  "subcategory": "celebration",
  "tags": [],
  "tone": [
    "energetic",
    "professional"
  ],
  "primary_emotion": "",
  "recommended_use": "",
  "avoid_if": null,
  "content_rating": "g",
  "duration_seconds": null,
  "dimensions": {
    "width": 500.0,
    "height": 500.0
  },
  "weight_kb": 247.3,
  "brand_compatible": [
    "Acme Corp"
  ],
  "license_note": "Sourced via GIPHY API. Review GIPHY API & Terms of Use (developers.giphy.com/docs/api) before external/client use. Attribution and caching terms may differ for external distribution.",
  "date_added": "2026-07-16T23:49:19.889203+00:00",
  "added_by": "automatic-script",
  "review_pending": true
}
