{
  "id": "619da2cb9f",
  "filename": "closing/thank-you/619da2cb9f.gif",
  "source": "giphy",
  "source_id": "xT77XWum9yH7zNkFW0",
  "source_url": "https://giphy.com/gifs/9jumpin-wow-nice-well-done-xT77XWum9yH7zNkFW0",
  "category": "closing",
  "subcategory": "thank-you",
  "tags": [],
  "tone": [
    "formal",
    "calm"
  ],
  "primary_emotion": "",
  "recommended_use": "",
  "avoid_if": null,
  "content_rating": "g",
  "duration_seconds": null,
  "dimensions": {
    "width": 500.0,
    "height": 281.0
  },
  "weight_kb": 6159.9,
  "brand_compatible": [
    "Library"
  ],
  "license_note": "Sourced via GIPHY API. Review GIPHY API & Terms of Use (developers.giphy.com/docs/api) before external/client use. Attribution and caching terms may differ for external distribution.",
  "date_added": "2026-07-17T01:03:05.408505+00:00",
  "added_by": "automatic-script",
  "review_pending": true
}
