{
  "id": "d613d998d4",
  "filename": "reactions/celebration/d613d998d4.gif",
  "source": "giphy",
  "source_id": "1BfPP1taCof3s61x71",
  "source_url": "https://giphy.com/gifs/fcbayern-football-celebration-1BfPP1taCof3s61x71",
  "category": "reactions",
  "subcategory": "celebration",
  "tags": [],
  "tone": [
    "energetic"
  ],
  "primary_emotion": "",
  "recommended_use": "",
  "avoid_if": null,
  "content_rating": "g",
  "duration_seconds": null,
  "dimensions": {
    "width": 480.0,
    "height": 480.0
  },
  "weight_kb": 7096.2,
  "brand_compatible": [
    "Library"
  ],
  "license_note": "Sourced via GIPHY API. Review GIPHY API & Terms of Use (developers.giphy.com/docs/api) before external/client use. Attribution and caching terms may differ for external distribution.",
  "date_added": "2026-07-17T20:13:28.950134+00:00",
  "added_by": "automatic-script",
  "review_pending": true
}
