{
  "id": "637d9d965a",
  "filename": "closing/thank-you/637d9d965a.gif",
  "source": "giphy",
  "source_id": "ZX7lojgj6jMLsaKIsE",
  "source_url": "https://giphy.com/gifs/theecards-thank-you-so-much-sincere-thanks-mch-ZX7lojgj6jMLsaKIsE",
  "category": "closing",
  "subcategory": "thank-you",
  "tags": [],
  "tone": [
    "formal",
    "calm"
  ],
  "primary_emotion": "",
  "recommended_use": "",
  "avoid_if": null,
  "content_rating": "g",
  "duration_seconds": null,
  "dimensions": {
    "width": 500.0,
    "height": 500.0
  },
  "weight_kb": 418.9,
  "brand_compatible": [
    "Library"
  ],
  "license_note": "Sourced via GIPHY API. Review GIPHY API & Terms of Use (developers.giphy.com/docs/api) before external/client use. Attribution and caching terms may differ for external distribution.",
  "date_added": "2026-07-17T20:13:58.327393+00:00",
  "added_by": "automatic-script",
  "review_pending": true
}
