{
  "id": "3cb01dcb09",
  "filename": "reactions/approval/3cb01dcb09.gif",
  "source": "giphy",
  "source_id": "iBEW5Amz0ztza",
  "source_url": "https://giphy.com/gifs/happy-excited-kat-dennings-iBEW5Amz0ztza",
  "category": "reactions",
  "subcategory": "approval",
  "tags": [
    "nailed-it",
    "approval",
    "confident",
    "success",
    "smug",
    "caption"
  ],
  "tone": [
    "professional",
    "casual"
  ],
  "primary_emotion": "confidence",
  "recommended_use": "when something is approved",
  "avoid_if": null,
  "content_rating": "g",
  "duration_seconds": null,
  "dimensions": {
    "width": 250.0,
    "height": 250.0
  },
  "weight_kb": 435.3,
  "brand_compatible": [
    "Library"
  ],
  "license_note": "Sourced via GIPHY API. Review GIPHY API & Terms of Use (developers.giphy.com/docs/api) before external/client use. Attribution and caching terms may differ for external distribution.",
  "date_added": "2026-07-17T20:13:31.153472+00:00",
  "added_by": "automatic-script",
  "review_pending": false
}
