{
  "id": "c72551fc9e",
  "filename": "reactions/celebration/c72551fc9e.gif",
  "source": "giphy",
  "source_id": "Ch9p05CKBhFw6ps7al",
  "source_url": "https://giphy.com/gifs/laguarimba-work-office-guarimba-Ch9p05CKBhFw6ps7al",
  "category": "reactions",
  "subcategory": "celebration",
  "tags": [],
  "tone": [
    "energetic",
    "professional"
  ],
  "primary_emotion": "",
  "recommended_use": "",
  "avoid_if": null,
  "content_rating": "g",
  "duration_seconds": null,
  "dimensions": {
    "width": 480.0,
    "height": 480.0
  },
  "weight_kb": 1856.0,
  "brand_compatible": [
    "Acme Corp"
  ],
  "license_note": "Sourced via GIPHY API. Review GIPHY API & Terms of Use (developers.giphy.com/docs/api) before external/client use. Attribution and caching terms may differ for external distribution.",
  "date_added": "2026-07-16T23:49:21.169062+00:00",
  "added_by": "automatic-script",
  "review_pending": true
}
