{
  "id": "7e803a84e7",
  "filename": "reactions/celebration/7e803a84e7.gif",
  "source": "giphy",
  "source_id": "ZGBQhaRTHyWtRVn1Xx",
  "source_url": "https://giphy.com/gifs/Friends-season-9-friends-tv-the-one-with-soap-opera-party-ZGBQhaRTHyWtRVn1Xx",
  "category": "reactions",
  "subcategory": "celebration",
  "tags": [],
  "tone": [
    "energetic",
    "professional"
  ],
  "primary_emotion": "",
  "recommended_use": "",
  "avoid_if": null,
  "content_rating": "g",
  "duration_seconds": null,
  "dimensions": {
    "width": 480.0,
    "height": 400.0
  },
  "weight_kb": 2096.9,
  "brand_compatible": [
    "Acme Corp"
  ],
  "license_note": "Sourced via GIPHY API. Review GIPHY API & Terms of Use (developers.giphy.com/docs/api) before external/client use. Attribution and caching terms may differ for external distribution.",
  "date_added": "2026-07-16T23:48:44.867992+00:00",
  "added_by": "automatic-script",
  "review_pending": true
}
