{
  "id": "2b86838da3",
  "filename": "reactions/waiting-loading/2b86838da3.gif",
  "source": "giphy",
  "source_id": "RhBexYjdW27t9vKG5M",
  "source_url": "https://giphy.com/gifs/waiting-dave-personalization-RhBexYjdW27t9vKG5M",
  "category": "reactions",
  "subcategory": "waiting-loading",
  "tags": [
    "waiting",
    "loading"
  ],
  "tone": [
    "minimalist",
    "calm"
  ],
  "primary_emotion": "patience",
  "recommended_use": "while something loads or during a pause",
  "avoid_if": null,
  "content_rating": "g",
  "duration_seconds": null,
  "dimensions": {
    "width": 500.0,
    "height": 275.0
  },
  "weight_kb": 140.4,
  "brand_compatible": [
    "Library"
  ],
  "license_note": "Sourced via GIPHY API. Review GIPHY API & Terms of Use (developers.giphy.com/docs/api) before external/client use. Attribution and caching terms may differ for external distribution.",
  "date_added": "2026-07-17T01:02:03.122727+00:00",
  "added_by": "automatic-script",
  "review_pending": false
}
