{
  "id": "b90fec2c54",
  "filename": "closing/thank-you/b90fec2c54.gif",
  "source": "giphy",
  "source_id": "IcGkqdUmYLFGE",
  "source_url": "https://giphy.com/gifs/IcGkqdUmYLFGE",
  "category": "closing",
  "subcategory": "thank-you",
  "tags": [],
  "tone": [
    "formal",
    "calm"
  ],
  "primary_emotion": "",
  "recommended_use": "",
  "avoid_if": null,
  "content_rating": "g",
  "duration_seconds": null,
  "dimensions": {
    "width": 400.0,
    "height": 225.0
  },
  "weight_kb": 1486.9,
  "brand_compatible": [
    "Library"
  ],
  "license_note": "Sourced via GIPHY API. Review GIPHY API & Terms of Use (developers.giphy.com/docs/api) before external/client use. Attribution and caching terms may differ for external distribution.",
  "date_added": "2026-07-17T01:03:01.334378+00:00",
  "added_by": "automatic-script",
  "review_pending": true
}
