{
  "id": "372f7bfaa3",
  "filename": "transitions/outro/372f7bfaa3.gif",
  "source": "giphy",
  "source_id": "quaIONOP1uJNlu2pd8",
  "source_url": "https://giphy.com/gifs/fxnetworks-see-you-later-ya-catch-quaIONOP1uJNlu2pd8",
  "category": "transitions",
  "subcategory": "outro",
  "tags": [
    "outro",
    "transition"
  ],
  "tone": [
    "casual"
  ],
  "primary_emotion": "closure",
  "recommended_use": "end of a section",
  "avoid_if": null,
  "content_rating": "g",
  "duration_seconds": null,
  "dimensions": {
    "width": 480.0,
    "height": 480.0
  },
  "weight_kb": 942.0,
  "brand_compatible": [
    "Library"
  ],
  "license_note": "Sourced via GIPHY API. Review GIPHY API & Terms of Use (developers.giphy.com/docs/api) before external/client use. Attribution and caching terms may differ for external distribution.",
  "date_added": "2026-07-17T20:13:45.585699+00:00",
  "added_by": "automatic-script",
  "review_pending": false
}
