{
  "id": "0b1ba9439c",
  "filename": "closing/thank-you/0b1ba9439c.gif",
  "source": "giphy",
  "source_id": "3oEjHWXddcCOGZNmFO",
  "source_url": "https://giphy.com/gifs/chuber-thanks-thank-you-a-bunch-3oEjHWXddcCOGZNmFO",
  "category": "closing",
  "subcategory": "thank-you",
  "tags": [
    "thank-you",
    "thanks-a-bunch",
    "bananas",
    "pun",
    "black-and-white",
    "meme"
  ],
  "tone": [
    "formal",
    "calm"
  ],
  "primary_emotion": "gratitude",
  "recommended_use": "thanking the audience",
  "avoid_if": null,
  "content_rating": "g",
  "duration_seconds": null,
  "dimensions": {
    "width": 480.0,
    "height": 386.0
  },
  "weight_kb": 507.3,
  "brand_compatible": [
    "Library"
  ],
  "license_note": "Sourced via GIPHY API. Review GIPHY API & Terms of Use (developers.giphy.com/docs/api) before external/client use. Attribution and caching terms may differ for external distribution.",
  "date_added": "2026-07-17T22:13:21.429427+00:00",
  "added_by": "automatic-script",
  "review_pending": false
}
