{
  "id": "d7b2226dd2",
  "filename": "reactions/celebration/d7b2226dd2.gif",
  "source": "giphy",
  "source_id": "N9F3sKI3vZsmdmBYvm",
  "source_url": "https://giphy.com/gifs/calmlings-happy-smile-waving-N9F3sKI3vZsmdmBYvm",
  "category": "reactions",
  "subcategory": "celebration",
  "tags": [],
  "tone": [
    "energetic",
    "professional"
  ],
  "primary_emotion": "",
  "recommended_use": "",
  "avoid_if": null,
  "content_rating": "g",
  "duration_seconds": null,
  "dimensions": {
    "width": 480.0,
    "height": 480.0
  },
  "weight_kb": 740.0,
  "brand_compatible": [
    "Acme Corp"
  ],
  "license_note": "Sourced via GIPHY API. Review GIPHY API & Terms of Use (developers.giphy.com/docs/api) before external/client use. Attribution and caching terms may differ for external distribution.",
  "date_added": "2026-07-16T23:49:02.881006+00:00",
  "added_by": "automatic-script",
  "review_pending": true
}
