{
  "id": "0ed581f930",
  "filename": "reactions/waiting-loading/0ed581f930.gif",
  "source": "giphy",
  "source_id": "2WjpfxAI5MvC9Nl8U7",
  "source_url": "https://giphy.com/gifs/future-circle-loading-2WjpfxAI5MvC9Nl8U7",
  "category": "reactions",
  "subcategory": "waiting-loading",
  "tags": [
    "waiting",
    "loading"
  ],
  "tone": [
    "minimalist",
    "calm"
  ],
  "primary_emotion": "patience",
  "recommended_use": "while something loads or during a pause",
  "avoid_if": null,
  "content_rating": "g",
  "duration_seconds": null,
  "dimensions": {
    "width": 480.0,
    "height": 272.0
  },
  "weight_kb": 1725.1,
  "brand_compatible": [
    "Library"
  ],
  "license_note": "Sourced via GIPHY API. Review GIPHY API & Terms of Use (developers.giphy.com/docs/api) before external/client use. Attribution and caching terms may differ for external distribution.",
  "date_added": "2026-07-17T01:02:00.031802+00:00",
  "added_by": "automatic-script",
  "review_pending": false
}
