{
  "id": "3cbe6a13f4",
  "filename": "reactions/surprise/3cbe6a13f4.gif",
  "source": "giphy",
  "source_id": "2Ap4K8iVUpbpmbj5oV",
  "source_url": "https://giphy.com/gifs/snl-saturday-night-live-season-48-2Ap4K8iVUpbpmbj5oV",
  "category": "reactions",
  "subcategory": "surprise",
  "tags": [
    "surprise",
    "shock"
  ],
  "tone": [
    "energetic",
    "playful"
  ],
  "primary_emotion": "surprise",
  "recommended_use": "reacting to an unexpected result",
  "avoid_if": null,
  "content_rating": "g",
  "duration_seconds": null,
  "dimensions": {
    "width": 480.0,
    "height": 250.0
  },
  "weight_kb": 1178.5,
  "brand_compatible": [
    "Library"
  ],
  "license_note": "Sourced via GIPHY API. Review GIPHY API & Terms of Use (developers.giphy.com/docs/api) before external/client use. Attribution and caching terms may differ for external distribution.",
  "date_added": "2026-07-17T20:13:34.533234+00:00",
  "added_by": "automatic-script",
  "review_pending": false
}
