{
  "id": "ed1512203d",
  "filename": "emphasis/key-point/ed1512203d.gif",
  "source": "giphy",
  "source_id": "YiXnP6e5z0CBQx0poj",
  "source_url": "https://giphy.com/gifs/Bounce-TV-im-listening-i-hear-you-all-ears-YiXnP6e5z0CBQx0poj",
  "category": "emphasis",
  "subcategory": "key-point",
  "tags": [],
  "tone": [
    "professional"
  ],
  "primary_emotion": "",
  "recommended_use": "",
  "avoid_if": null,
  "content_rating": "g",
  "duration_seconds": null,
  "dimensions": {
    "width": 400.0,
    "height": 400.0
  },
  "weight_kb": 987.9,
  "brand_compatible": [
    "Library"
  ],
  "license_note": "Sourced via GIPHY API. Review GIPHY API & Terms of Use (developers.giphy.com/docs/api) before external/client use. Attribution and caching terms may differ for external distribution.",
  "date_added": "2026-07-17T22:13:08.421277+00:00",
  "added_by": "automatic-script",
  "review_pending": true
}
