{
  "id": "da0c4e0bf1",
  "filename": "transitions/intro/da0c4e0bf1.gif",
  "source": "giphy",
  "source_id": "Y8ocCgwtdj29O",
  "source_url": "https://giphy.com/gifs/marty-culp-Y8ocCgwtdj29O",
  "category": "transitions",
  "subcategory": "intro",
  "tags": [],
  "tone": [
    "casual",
    "professional"
  ],
  "primary_emotion": "",
  "recommended_use": "",
  "avoid_if": null,
  "content_rating": "g",
  "duration_seconds": null,
  "dimensions": {
    "width": 444.0,
    "height": 404.0
  },
  "weight_kb": 373.5,
  "brand_compatible": [
    "Library"
  ],
  "license_note": "Sourced via GIPHY API. Review GIPHY API & Terms of Use (developers.giphy.com/docs/api) before external/client use. Attribution and caching terms may differ for external distribution.",
  "date_added": "2026-07-17T01:02:05.774917+00:00",
  "added_by": "automatic-script",
  "review_pending": true
}
