{
  "id": "705ae03a8d",
  "filename": "emphasis/key-point/705ae03a8d.gif",
  "source": "giphy",
  "source_id": "r0TUVI6rVS2r4OCjTf",
  "source_url": "https://giphy.com/gifs/white-rabbit-matter-of-time-all-roads-lead-to-rome-r0TUVI6rVS2r4OCjTf",
  "category": "emphasis",
  "subcategory": "key-point",
  "tags": [],
  "tone": [
    "professional"
  ],
  "primary_emotion": "",
  "recommended_use": "",
  "avoid_if": null,
  "content_rating": "g",
  "duration_seconds": null,
  "dimensions": {
    "width": 382.0,
    "height": 480.0
  },
  "weight_kb": 117.9,
  "brand_compatible": [
    "Library"
  ],
  "license_note": "Sourced via GIPHY API. Review GIPHY API & Terms of Use (developers.giphy.com/docs/api) before external/client use. Attribution and caching terms may differ for external distribution.",
  "date_added": "2026-07-17T22:13:07.298323+00:00",
  "added_by": "automatic-script",
  "review_pending": true
}
