{
  "id": "160f74a232",
  "filename": "transitions/topic-change/160f74a232.gif",
  "source": "giphy",
  "source_id": "3og0IUCy6UyBfn7XTG",
  "source_url": "https://giphy.com/gifs/producthunt-virtual-reality-webvr-3og0IUCy6UyBfn7XTG",
  "category": "transitions",
  "subcategory": "topic-change",
  "tags": [
    "vr-headset",
    "goggles",
    "icon",
    "tech",
    "next-scene"
  ],
  "tone": [
    "minimalist",
    "professional"
  ],
  "primary_emotion": "anticipation",
  "recommended_use": "changing topic",
  "avoid_if": null,
  "content_rating": "g",
  "duration_seconds": null,
  "dimensions": {
    "width": 480.0,
    "height": 244.0
  },
  "weight_kb": 476.0,
  "brand_compatible": [
    "Library"
  ],
  "license_note": "Sourced via GIPHY API. Review GIPHY API & Terms of Use (developers.giphy.com/docs/api) before external/client use. Attribution and caching terms may differ for external distribution.",
  "date_added": "2026-07-17T20:13:46.770924+00:00",
  "added_by": "automatic-script",
  "review_pending": false
}
