{
  "id": "3f84aca979",
  "filename": "reactions/waiting-loading/3f84aca979.gif",
  "source": "giphy",
  "source_id": "6DlmKcJq0wFNIyoV5y",
  "source_url": "https://giphy.com/gifs/Zhot-time-clock-zhot-6DlmKcJq0wFNIyoV5y",
  "category": "reactions",
  "subcategory": "waiting-loading",
  "tags": [
    "hourglass",
    "waiting",
    "cartoon",
    "time",
    "countdown"
  ],
  "tone": [
    "minimalist",
    "calm"
  ],
  "primary_emotion": "anticipation",
  "recommended_use": "while something loads",
  "avoid_if": null,
  "content_rating": "g",
  "duration_seconds": null,
  "dimensions": {
    "width": 384.0,
    "height": 480.0
  },
  "weight_kb": 2275.6,
  "brand_compatible": [
    "Library"
  ],
  "license_note": "Sourced via GIPHY API. Review GIPHY API & Terms of Use (developers.giphy.com/docs/api) before external/client use. Attribution and caching terms may differ for external distribution.",
  "date_added": "2026-07-17T20:13:40.483654+00:00",
  "added_by": "automatic-script",
  "review_pending": false
}
