{
  "id": "f9e54ec759",
  "filename": "collaboration/brainstorm-ideas/f9e54ec759.gif",
  "source": "giphy",
  "source_id": "VbEuHLBUPQm55MyqJg",
  "source_url": "https://giphy.com/gifs/creative-thinking-thinker-VbEuHLBUPQm55MyqJg",
  "category": "collaboration",
  "subcategory": "brainstorm-ideas",
  "tags": [
    "thinking",
    "brain",
    "ideas",
    "profile",
    "pondering"
  ],
  "tone": [
    "energetic",
    "playful"
  ],
  "primary_emotion": "focus",
  "recommended_use": "ideation / brainstorming",
  "avoid_if": null,
  "content_rating": "g",
  "duration_seconds": null,
  "dimensions": {
    "width": 440.0,
    "height": 480.0
  },
  "weight_kb": 1049.4,
  "brand_compatible": [
    "Library"
  ],
  "license_note": "Sourced via GIPHY API. Review GIPHY API & Terms of Use (developers.giphy.com/docs/api) before external/client use. Attribution and caching terms may differ for external distribution.",
  "date_added": "2026-07-17T20:13:56.712220+00:00",
  "added_by": "automatic-script",
  "review_pending": false
}
