{
  "id": "928d2dedc3",
  "filename": "transitions/topic-change/928d2dedc3.gif",
  "source": "giphy",
  "source_id": "T4fDGOcxs5qmslH7fT",
  "source_url": "https://giphy.com/gifs/HallmarkChannel-season-3-the-way-home-twh-T4fDGOcxs5qmslH7fT",
  "category": "transitions",
  "subcategory": "topic-change",
  "tags": [],
  "tone": [
    "minimalist",
    "professional"
  ],
  "primary_emotion": "",
  "recommended_use": "",
  "avoid_if": null,
  "content_rating": "g",
  "duration_seconds": null,
  "dimensions": {
    "width": 480.0,
    "height": 270.0
  },
  "weight_kb": 1481.5,
  "brand_compatible": [
    "Library"
  ],
  "license_note": "Sourced via GIPHY API. Review GIPHY API & Terms of Use (developers.giphy.com/docs/api) before external/client use. Attribution and caching terms may differ for external distribution.",
  "date_added": "2026-07-17T20:13:48.172142+00:00",
  "added_by": "automatic-script",
  "review_pending": true
}
