{
  "id": "be20b18a00",
  "filename": "reactions/celebration/be20b18a00.gif",
  "source": "giphy",
  "source_id": "31lPv5L3aIvTi",
  "source_url": "https://giphy.com/gifs/friends-excited-31lPv5L3aIvTi",
  "category": "reactions",
  "subcategory": "celebration",
  "tags": [],
  "tone": [
    "energetic"
  ],
  "primary_emotion": "",
  "recommended_use": "",
  "avoid_if": null,
  "content_rating": "g",
  "duration_seconds": null,
  "dimensions": {
    "width": 414.0,
    "height": 314.0
  },
  "weight_kb": 993.5,
  "brand_compatible": [
    "Library"
  ],
  "license_note": "Sourced via GIPHY API. Review GIPHY API & Terms of Use (developers.giphy.com/docs/api) before external/client use. Attribution and caching terms may differ for external distribution.",
  "date_added": "2026-07-17T22:12:39.460516+00:00",
  "added_by": "automatic-script",
  "review_pending": true
}
